{
  "version": 1,
  "updatedAt": "2026-07-26T01:18:13.196Z",
  "siteUpdatedOn": "2026-07-26",
  "entries": [
    {
      "id": "2026-07-26-addon-armor-and-vehicle-model-fixes",
      "date": "2026-07-26",
      "title": "附加装甲与载具模型修复",
      "items": [
        "修正 ASLAV 车体首下附加装甲的伤害吸收结算；M919 等穿甲弹会在伤害卡片中正确扣除 50 点吸收值。",
        "清理 ASLAV、LAV 6 等载具车底的过期重复武器外观，并移除 LAV 6 未挂载 CROWS 的命中代理；合法武器挂载保持不变。",
        "T-90A 炮塔无伤害碰撞层现按实机 40 点吸收证据归入附加装甲；T-72B3 仅属于外观壳的装甲块保持外观组件，不虚构命中或伤害数据。"
      ]
    },
    {
      "id": "2026-07-25-weapons-and-dual-edition-polish",
      "date": "2026-07-25",
      "title": "武器选择器与双站界面更新",
      "items": [
        "步兵武器现已置于攻击来源顶部，按反装甲、高穿弹、轻武器、低穿武器分类并按穿深降序排列；等效重复配置已合并，便于快速定位。",
        "修正 M72A7 LAW 等反坦克火箭筒命中轻型载具时的伤害结算，补全步兵武器中文名称与图标，并统一穿深、伤害和破甲伤害标识。",
        "命中预览组件改用玩家易懂的中文名称；装甲厚度色阶调整为 0–800 毫米均匀分布，发动机恢复橙色并与弹药架使用不同机械材质。",
        "优化多变体缩略卡的切分、印象图对齐和连续高亮，并调整 3D 界面顶栏、搜索与返回按钮的对齐。",
        "国服首页人物高亮、阵营标签、三角旗与站点标题已修正；国际站首次载入提示精简并移出阵营目录区域。",
        "分享穿透路径现在会用短链接同时保留 3D 查看角度、距离与平移位置；修复外观贴图完成后切换模式重置视角，以及分享链接重开后载具低于参考平面的问题。",
        "外观模式新增默认关闭的附加装甲高亮选项；破甲武器的穿透路径图例现显示专属破甲图标。"
      ]
    },
    {
      "id": "2026-07-24-exterior-hit-shared-footer",
      "date": "2026-07-24",
      "title": "外观命中与双站共享内容",
      "items": [
        "外观模式现已支持实时厚度提示、点击命中解析与射线保留；贴图渐进载入提示改为视口顶部居中弱提醒。",
        "国服与国际版改用同一份可热更新赞助/友链名单，并在同一个更新日志弹窗中提供双站切换，默认显示当前站点日志。",
        "调整国际版 PLAAGF 与 PLA 的人物轮盘及阵营目录顺序，使 PLA 位于 PLAAGF 右侧。"
      ]
    },
    {
      "id": "2026-07-24-shared-china-runtime",
      "date": "2026-07-24",
      "title": "国服与国际站共享 3D 内核",
      "items": [
        "国服五阵营现已使用国际站同一套载具卡片、3D 查看器、命中图、防护图、图例、缓存与资源组织代码。",
        "保留国服五人物阵营选择器、旗帜三角构图及既有名称；两站继续使用彼此独立的公开资源输出。",
        "两站左上角新增相互跳转入口，并移除部署包中不再使用的旧国服查看器副本。"
      ]
    },
    {
      "id": "2026-07-24-protection-search-homepage",
      "date": "2026-07-24",
      "title": "防护图与首页检索体验",
      "items": [
        "外观、装甲与内构模式现在都可计算防护图；新增 2 倍宽高精算的超级档，并在界面明确提示高负载风险。",
        "提高首页阵营选择标题、当前阵营与 AI 形象声明的可读性，调整人物旗帜高度并修正阵营目录与搜索框的对齐、遮挡关系。",
        "载具中文名称、配置与武器词条新增构建时拼音索引，支持全拼片段及轻度错拼搜索。",
        "降低内构模式下非内构组件的描边亮度，并恢复维护者 B站主页链接。"
      ]
    },
    {
      "id": "2026-07-22-international-catalog",
      "date": "2026-07-22",
      "title": "国际服完整载具目录",
      "items": [
        "接入 17 个国际服阵营、384 个载具家族与 604 张变体卡片。",
        "首页阵营选择改用阵营人物原画，并保留公开版目录、详情与 3D 查看器视觉体系。"
      ]
    },
    {
      "id": "2026-07-18-share-hit-state",
      "date": "2026-07-18",
      "title": "命中状态链接分享",
      "items": [
        "分享网页链接时现在会一并携带当前命中路径状态，接收者打开链接即可还原对应的载具分析结果。"
      ]
    },
    {
      "id": "2026-07-17-footer-content",
      "date": "2026-07-17",
      "title": "页脚内容与资料展示更新",
      "items": [
        "新增可热更新的赞助名单与更新日志，后续内容调整无需重新发布整站。",
        "网站左下角版本日期现在跟随最近一次更新日志发布自动更新。"
      ]
    }
  ]
}
